{"incident":{"trace_id":"tr_audit_001","schema_version":"1.0","scenario_id":"S01","severity_hint":"high","raw_event_refs":["evt_s01_001"],"tasks":["collect_evidence","plan_response","audit"],"status":"awaiting_approval"},"evidence_items":[{"evidence_id":"ev_evt_s01_001","trace_id":"tr_audit_001","source_ref":"evt_s01_001","statement":"Supplied synthetic event records an anomalous login.","classification":"fact","confidence":"high","evidence_level":"strong","related_event_refs":["evt_s01_001"]}],"response_plan":{"plan_id":"rp_tr_audit_001","trace_id":"tr_audit_001","risk_level":"high","actions":["建议：等待人工审批后限制高风险会话。"],"verification_steps":["核对证据引用。"],"rollback_steps":["建议恢复审批前状态。"],"requires_approval":true,"status":"pending_approval"},"approval":{"trace_id":"tr_audit_001","approver_role":"human_operator","status":"approved","timestamp":"2026-08-04T00:00:00Z"},"ledger_records":[{"event_id":"ledger_001","trace_id":"tr_audit_001","at":"2026-08-04T09:00:00Z","actor":"test","event_type":"incident.created","payload_ref":"incident:tr_audit_001","prev_hash":"","hash":"19f03498ec029518a54cb7791e4ca222f2df70de73cb8c9b62f36614eb0eda8f"},{"event_id":"ledger_002","trace_id":"tr_audit_001","at":"2026-08-04T09:00:00Z","actor":"test","event_type":"evidence.completed","payload_ref":"evidence:ev_evt_s01_001","prev_hash":"19f03498ec029518a54cb7791e4ca222f2df70de73cb8c9b62f36614eb0eda8f","hash":"1600d5f8384f6f4ea20dd71fd7c7401f5edb36ea1bd3a112247686f8af5bcf5a"},{"event_id":"ledger_003","trace_id":"tr_audit_001","at":"2026-08-04T09:00:00Z","actor":"test","event_type":"response.pending_approval","payload_ref":"response:rp_tr_audit_001","prev_hash":"1600d5f8384f6f4ea20dd71fd7c7401f5edb36ea1bd3a112247686f8af5bcf5a","hash":"d9fe0b7b71fb75ebe8376170dca44f73faa49f9496f41128b19e7081145b9936"},{"event_id":"ledger_004","trace_id":"tr_audit_001","at":"2026-08-04T09:00:00Z","actor":"test","event_type":"approval.approved","payload_ref":"approval:approved","prev_hash":"d9fe0b7b71fb75ebe8376170dca44f73faa49f9496f41128b19e7081145b9936","hash":"bc0117777fbffb7c0c402c9493e4effea4e8ec959c1ed4eb802431306ea4a8ca"},{"event_id":"ledger_005","trace_id":"tr_audit_001","at":"2026-08-04T09:00:00Z","actor":"test","event_type":"audit.projected","payload_ref":"audit:tr_audit_001","prev_hash":"bc0117777fbffb7c0c402c9493e4effea4e8ec959c1ed4eb802431306ea4a8ca","hash":"ec481826f4cafa1b565f24a37e18afa33821aefe98ebd53604a3e41349504ad4"}]}
